<!DOCTYPE Combination  SYSTEM 'AnaWSBuilder.dtd'>  
<Combination WorkspaceName="combWS" ModelConfigName="ModelConfig" DataName="combData" OutputFile="workspace/ttH/tth.root" >
  <Input>config/ttH/ttHhad.xml</Input>
  <Input>config/ttH/ttHlep.xml</Input>
  <Input>config/ttH/7TeV_ttHhad.xml</Input>
  <Input>config/ttH/7TeV_ttHlep.xml</Input>
  <POI>mu_ttH,mu,mH</POI>
  <Asimov Name="AsimovB"  Setup="mu=0,mH=125.4"      Action="fixsyst:fit:genasimov:float:savesnapshot" SnapshotAll="ucmles_0" SnapshotNuis="nominalNuis" SnapshotGlob="nominalGlob"/>
  <Asimov Name="AsimovSB"  Setup="mu=1,mH=125.4"     Action="genasimov:reset"/>
  <Asimov Name="single_mu_fit" Setup="mu=1_0_5,mu_ttH=1,mH=125.4" Action="fit:savesnapshot:reset" SnapshotAll="ucmles_mu" SnapshotNuis="conditionalNuis_muhat" SnapshotGlob="conditionalGlob_muhat"/>
  <Asimov Name="single_mu_ttH_fit" Setup="mu_ttH=1_0_5,mu=1,mH=125.4" Action="fit:savesnapshot" SnapshotAll="ucmles_mu_ttH" SnapshotNuis="conditionalNuis_mu_ttHhat" SnapshotGlob="conditionalGlob_mu_ttHhat"/>
</Combination>

