<!DOCTYPE Channel SYSTEM 'AnaWSBuilder.dtd'>
<Channel Name="side" Type="counting" Lumi="20.3">
  <Data NumData="9" Observable="atlas_invMass_side[0,1]"/>
  
  <Systematic Name="ATLAS_lumi_2012" Constr="logn" CentralValue="1" Mag="0.028" WhereTo="yield"/>
  <Systematic Name="ATLAS_PHOTON_ID" Constr="logn" CentralValue="1" Mag="0.0245" WhereTo="yield"/>
  <Systematic Name="ATLAS_PHOTON_ISO" Constr="logn" CentralValue="1" Mag="0.02" WhereTo="yield"/>
  
  <Systematic Name="SigFracYY" Constr="logn" CentralValue="1" Mag="0.016" WhereTo="shape"/>
  <Systematic Name="SigMassYY" Constr="logn" CentralValue="1" Mag="0.017" WhereTo="shape"/>

  <Item Name="srFracYY[0.926145]"/>
  <Item Name="srFracYYBB[0.95]"/>
  <Item Name="effiYYBB[0.180071]"/>
  <Item Name="smEffiYYBB[0.107006]"/>
  <Item Name="extrapYY[0.147]"/>
  <Item Name="BRyy[0.00228]"/>
  <Item Name="BRbb[0.569]"/>
  <Item Name="cutsEffi[0.0430209]"/>
  <Item Name="luminosity[20276.9]"/>

  <!-- "response::" pre-fix means response term from a systematic uncertainty -->
  <Item Name="prod::kSigFracYY(response::SigFracYY, response::SigMassYY)"/>
  
  <Item Name="expr::ScaleFactorSM('1-@0*@1', srFracYY, kSigFracYY)"/>
  <Item Name="expr::ScaleFactorBSM('(1-@0*@1)*(2*@2*@3*@4*@5)', srFracYY, kSigFracYY, BRyy, BRbb,cutsEffi,luminosity)"/>
  <Item Name="ScaleFactorBkg[1]"/>

  <Sample Name="ggH" Norm="0.025407" ImportSyst=":common:" MultiplyLumi="0" SharePdf="commonCounting">
    <Systematic Name="BR_gamgam" Constr="logn" CentralValue="1" Mag="0.049" WhereTo="yield"/>
    <Systematic Name="QCDscale_ggH" Constr="asym" CentralValue="1" Mag="+0.072,-0.078" WhereTo="yield"/>
    <Systematic Name="pdf_gg" Constr="asym" CentralValue="1" Mag="+0.075,-0.069" WhereTo="yield"/>    
    <Systematic Name="HF_gg" Constr="logn" CentralValue="1" Mag="2.0" WhereTo="yield"/>    
    <Systematic Name="ATLAS_stat_ggH" Constr="logn" CentralValue="1" Mag="0.13" WhereTo="yield"/>    
    <Systematic Name="ATLAS_JES" Constr="gaus" CentralValue="1" Mag="0.21" WhereTo="yield"/>
    <Systematic Name="ATLAS_JER" Constr="gaus" CentralValue="1" Mag="0.21" WhereTo="yield"/> 
    <Systematic Name="ATLAS_JVF" Constr="gaus" CentralValue="1" Mag="0.001" WhereTo="yield"/>
    <Systematic Name="ATLAS_BJES" Constr="gaus" CentralValue="1" Mag="0.07" WhereTo="yield"/> 
    <NormFactor Name="mu_XS8_ggH[1]" />
    <NormFactor Name="ScaleFactorSM" />
  </Sample>

  <Sample Name="VBF" Norm="0.004608" ImportSyst=":common:" MultiplyLumi="0" SharePdf="commonCounting">
    <Systematic Name="BR_gamgam" Constr="logn" CentralValue="1" Mag="0.049" WhereTo="yield"/>
    <Systematic Name="QCDscale_VBF" Constr="asym" CentralValue="1" Mag="+0.002,-0.002" WhereTo="yield"/>
    <Systematic Name="pdf_qq" Constr="asym" CentralValue="1" Mag="+0.027,-0.027" WhereTo="yield"/>    
    <Systematic Name="HF_qq" Constr="logn" CentralValue="1" Mag="1.5" WhereTo="yield"/>
    <Systematic Name="ATLAS_stat_VBF" Constr="logn" CentralValue="1" Mag="0.11" WhereTo="yield"/>
    <Systematic Name="ATLAS_JES" Constr="gaus" CentralValue="1" Mag="0.21" WhereTo="yield"/>
    <Systematic Name="ATLAS_JER" Constr="gaus" CentralValue="1" Mag="0.21" WhereTo="yield"/>
    <Systematic Name="ATLAS_JVF" Constr="gaus" CentralValue="1" Mag="0.001" WhereTo="yield"/>
    <Systematic Name="ATLAS_BJES" Constr="gaus" CentralValue="1" Mag="0.07" WhereTo="yield"/> 
    <NormFactor Name="mu_XS8_VBF[1]" />
    <NormFactor Name="ScaleFactorSM" />
  </Sample>

  <Sample Name="WH" Norm="0.001303" ImportSyst=":common:" MultiplyLumi="0" SharePdf="commonCounting">
    <Systematic Name="BR_gamgam" Constr="logn" CentralValue="1" Mag="0.049" WhereTo="yield"/>
    <Systematic Name="QCDscale_WH" Constr="asym" CentralValue="1" Mag="+0.01,-0.01" WhereTo="yield"/>
    <Systematic Name="pdf_qq" Constr="asym" CentralValue="1" Mag="+0.023,-0.023" WhereTo="yield"/>
    <Systematic Name="HF_qq" Constr="logn" CentralValue="1" Mag="1.5" WhereTo="yield"/>
    <Systematic Name="ATLAS_stat_WH" Constr="logn" CentralValue="1" Mag="0.17" WhereTo="yield"/>
    <Systematic Name="ATLAS_JES" Constr="gaus" CentralValue="1" Mag="0.21" WhereTo="yield"/>
    <Systematic Name="ATLAS_JER" Constr="gaus" CentralValue="1" Mag="0.21" WhereTo="yield"/>
    <Systematic Name="ATLAS_JVF" Constr="gaus" CentralValue="1" Mag="0.001" WhereTo="yield"/>
    <Systematic Name="ATLAS_BJES" Constr="gaus" CentralValue="1" Mag="0.07" WhereTo="yield"/> 
    <NormFactor Name="mu_XS8_WH[1]" />
    <NormFactor Name="ScaleFactorSM" />
  </Sample>

  <Sample Name="ZH" Norm="0.027678" ImportSyst=":common:" MultiplyLumi="0" SharePdf="commonCounting">
    <Systematic Name="BR_gamgam" Constr="logn" CentralValue="1" Mag="0.049" WhereTo="yield"/>
    <Systematic Name="QCDscale_ZH" Constr="asym" CentralValue="1" Mag="+0.031,-0.031" WhereTo="yield"/>
    <Systematic Name="pdf_qq" Constr="asym" CentralValue="1" Mag="+0.025,-0.025" WhereTo="yield"/>
    <Systematic Name="ATLAS_stat_ZH" Constr="logn" CentralValue="1" Mag="0.025" WhereTo="yield"/>
    <Systematic Name="ATLAS_JES" Constr="gaus" CentralValue="1" Mag="0.21" WhereTo="yield"/>
    <Systematic Name="ATLAS_JER" Constr="gaus" CentralValue="1" Mag="0.21" WhereTo="yield"/>
    <Systematic Name="ATLAS_JVF" Constr="gaus" CentralValue="1" Mag="0.001" WhereTo="yield"/>
    <Systematic Name="ATLAS_BJES" Constr="gaus" CentralValue="1" Mag="0.07" WhereTo="yield"/> 
    <NormFactor Name="mu_XS8_ZH[1]"/>
    <NormFactor Name="ScaleFactorSM" />
  </Sample>

  <Sample Name="ttH" Norm="0.138543" ImportSyst=":common:" MultiplyLumi="0" SharePdf="commonCounting">
    <Systematic Name="BR_gamgam" Constr="logn" CentralValue="1" Mag="0.049" WhereTo="yield"/>
    <Systematic Name="QCDscale_ttH" Constr="asym" CentralValue="1" Mag="+0.038,-0.093" WhereTo="yield"/>
    <Systematic Name="pdf_gg" Constr="asym" CentralValue="1" Mag="+0.081,-0.081" WhereTo="yield"/>
    <Systematic Name="ATLAS_stat_ttH" Constr="logn" CentralValue="1" Mag="0.010" WhereTo="yield"/>
    <Systematic Name="ATLAS_JES" Constr="gaus" CentralValue="1" Mag="0.21" WhereTo="yield"/>
    <Systematic Name="ATLAS_JER" Constr="gaus" CentralValue="1" Mag="0.21" WhereTo="yield"/>
    <Systematic Name="ATLAS_JVF" Constr="gaus" CentralValue="1" Mag="0.001" WhereTo="yield"/>
    <Systematic Name="ATLAS_BJES" Constr="gaus" CentralValue="1" Mag="0.07" WhereTo="yield"/> 
    <NormFactor Name="mu_XS8_ttH[1]"/>
    <NormFactor Name="ScaleFactorSM" />
  </Sample>

  <Sample Name="SMDH" Norm="0.036617" ImportSyst=":common:" MultiplyLumi="0" SharePdf="commonCounting">
    <Systematic Name="BR_gamgam" Constr="logn" CentralValue="1" Mag="0.049" WhereTo="yield"/>
    <Systematic Name="BR_bb" Constr="logn" CentralValue="1" Mag="0.033" WhereTo="yield"/>
    <Systematic Name="QCDscale_SMDH" Constr="asym" CentralValue="1" Mag="+0.203,-0.167" WhereTo="yield"/>
    <Systematic Name="pdf_gg" Constr="asym" CentralValue="1" Mag="+0.085,-0.069" WhereTo="yield"/>
    <Systematic Name="ATLAS_stat_SMDH" Constr="logn" CentralValue="1" Mag="0.012" WhereTo="yield"/>
    <Systematic Name="ATLAS_JES" Constr="gaus" CentralValue="1" Mag="0.21" WhereTo="yield"/>
    <Systematic Name="ATLAS_JER" Constr="gaus" CentralValue="1" Mag="0.21" WhereTo="yield"/>
    <Systematic Name="ATLAS_JVF" Constr="gaus" CentralValue="1" Mag="0.001" WhereTo="yield"/>
    <Systematic Name="ATLAS_BJES" Constr="gaus" CentralValue="1" Mag="0.07" WhereTo="yield"/> 
    <NormFactor Name="mu_XS8_SMDH[1]"/>
    <NormFactor Name="ScaleFactorSM" />
  </Sample>

  <Sample Name="BSM" Norm="1" ImportSyst=":common:" MultiplyLumi="0" SharePdf="commonCounting">
    <Systematic Name="BR_gamgam" Constr="logn" CentralValue="1" Mag="0.049" WhereTo="yield"/>
    <Systematic Name="BR_bb" Constr="logn" CentralValue="1" Mag="0.033" WhereTo="yield"/>
    <Systematic Name="ATLAS_stat_BSM" Constr="logn" CentralValue="1" Mag="0.017" WhereTo="yield"/>
    <Systematic Name="ATLAS_JES" Constr="gaus" CentralValue="1" Mag="0.038" WhereTo="yield"/>    
    <Systematic Name="ATLAS_JER" Constr="gaus" CentralValue="1" Mag="0.093" WhereTo="yield"/>
    <Systematic Name="ATLAS_JVF" Constr="gaus" CentralValue="1" Mag="0.002" WhereTo="yield"/> 
    <Systematic Name="ATLAS_BJES" Constr="gaus" CentralValue="1" Mag="0.022" WhereTo="yield"/> 
    <NormFactor Name="mu[1,0,50]"/>
    <NormFactor Name="ScaleFactorBSM" />
  </Sample>

  <Sample Name="Continuum" Norm="1" ImportSyst=":self:" MultiplyLumi="0" SharePdf="commonCounting">
    <NormFactor Name="nConinuum[9,0,20]" />
  </Sample>
</Channel>

