<!DOCTYPE Combination  SYSTEM 'AnaWSBuilder.dtd'>  
<Combination WorkspaceName="combWS" ModelConfigName="ModelConfig" DataName="combData" OutputFile="workspace/ttHyy/tthyy.root" >

  <Input>config/ttHyy/ttH_c27.xml</Input>
  <Input>config/ttHyy/ttH_c28.xml</Input>
  <Input>config/ttHyy/ttH_c29.xml</Input>
  <Input>config/ttHyy/ttH_c30.xml</Input>
  <Input>config/ttHyy/ttH_c31.xml</Input>
  <Input>config/ttHyy/ttH_c32.xml</Input>
  <Input>config/ttHyy/ttH_c33.xml</Input>
  <POI>mu_ttH,mu</POI>

  <Asimov Name="AsimovB"  Setup="mu=0"      Action="fixsyst:fit:genasimov:float:savesnapshot" SnapshotAll="ucmles_0" SnapshotNuis="nominalNuis" SnapshotGlob="nominalGlob"/>
  <Asimov Name="AsimovSB"  Setup="mu=1"     Action="genasimov:reset"/>
  <Asimov Name="single_mu_fit" Setup="mu=1_0_5,mu_ttH=1" Action="fit:savesnapshot:reset" SnapshotAll="ucmles_mu" SnapshotNuis="conditionalNuis_muhat" SnapshotGlob="conditionalGlob_muhat"/>
  <Asimov Name="single_mu_ttH_fit" Setup="mu_ttH=1_0_5,mu=1" Action="fit:savesnapshot" SnapshotAll="ucmles_mu_ttH" SnapshotNuis="conditionalNuis_mu_ttHhat" SnapshotGlob="conditionalGlob_mu_ttHhat"/>
  <Asimov Name="AsimovSB_postfit" Setup="mu_ttH=1,mu=1" Action="fit:matchglob:genasimov:savesnapshot:reset" SnapshotAll="ucmles_postfit_1" SnapshotNuis="conditionalNuis_1" SnapshotGlob="conditionalGlob_1"/>

</Combination>

