<!DOCTYPE Combination  SYSTEM 'AnaWSBuilder.dtd'>
<Combination WorkspaceName="combWS" ModelConfigName="ModelConfig" DataName="combData" OutputFile="workspace/high_mass_diphoton/1516_Graviton_histfactory_EKHI_v36.root" >
  <Input>config/high_mass_diphoton/graviton/2015/category_2015_Graviton_13TeV_histfactory_EKHI_v36.xml</Input>
  <Input>config/high_mass_diphoton/graviton/2016/category_2016_Graviton_13TeV_histfactory_EKHI_v36.xml</Input>
  <POI>xs,mG,GkM,xs_2015,xs_2016</POI>
  <Asimov Name="POISnap"  Setup=""  Action="savesnapshot" SnapshotPOI="nominalPOI"/>
  <Asimov Name="NPSnap"   Setup="xs=0,mG=750,GkM=0.2"      Action="fixsyst:fit:float:savesnapshot:nominalPOI" SnapshotNuis="nominalNuis" SnapshotGlob="nominalGlobs"/>
  <Asimov Name="asimovData_0" Setup="xs=0,mG=750,GkM=0.2"      Action="fit:genasimov:matchglob:savesnapshot:nominalGlobs" SnapshotGlob="conditionalGlobs_0" SnapshotNuis="conditionalNuis_0"/>
  <Asimov Name="UCMLES0Snap" Setup=""      Action="savesnapshot" SnapshotAll="ucmles_0"/>
</Combination>
