<!DOCTYPE Combination  SYSTEM 'AnaWSBuilder.dtd'>
<!-- 2016.06.13 -->
<Combination WorkspaceName="combWS" ModelConfigName="ModelConfig" DataName="combData" OutputFile="workspace/high_mass_diphoton/2015_Graviton_histfactory_EKHI_v36.root" >
  <Input>config/high_mass_diphoton/graviton/2015/category_2015_Graviton_13TeV_histfactory_EKHI_v36.xml</Input>
  <POI>xs,mG,GkM</POI>
  <Asimov Name="POISnap"  Setup=""  Action="savesnapshot" SnapshotPOI="nominalPOI"/>
  <Asimov Name="asimovData_nominal"   Setup="xs=0,mG=750,GkM=0.2"      Action="fixsyst:fit:float:genasimov:savesnapshot:nominalPOI" SnapshotNuis="nominalNuis" SnapshotGlob="nominalGlobs"/>
  <Asimov Name="asimovData_0" Setup="xs=0,mG=750,GkM=0.2"      Action="fit:genasimov:matchglob:savesnapshot:nominalGlobs" SnapshotGlob="conditionalGlobs_0" SnapshotNuis="conditionalNuis_0"/>
  <Asimov Name="UCMLES0Snap" Setup=""      Action="savesnapshot" SnapshotAll="ucmles_0"/>
  <Asimov Name="asimovData_muhat" Setup="xs=20_0_100,mG=750_730_770,GkM=0.20_0.01_0.5"      Action="fit:genasimov:matchglob:savesnapshot:nominalGlobs" SnapshotGlob="conditionalGlobs_muhat" SnapshotNuis="conditionalNuis_muhat" SnapshotPOI="conditionalPOI_muhat"/>
  <Asimov Name="UCMLESSnap" Setup=""      Action="savesnapshot" SnapshotAll="ucmles"/>
</Combination>
